Item Item DOI,question_text
10.21019/qna-901509,"What is the calculated Creatinine Clearance (CrCl) using the Cockcroft-Gault equation for MC, a 61-year-old cisgender woman who weighs 143 lb with serum creatinine (SCr) 1.5 mg/dL? Ideal body weight (IBW) of MC = 57 kg"
10.21019/qna-901510,"Dosing recommendations for cefepime are given as follows: Creatinine Clearance (CrCl) (mL/min) Dose Cefepime 1,000 mg/day is recommended for a patient with normal renal function. What should be the recommended dose of cefepime for a 72-year-old cisgender male who is 5’6”, 61 kg, and with a Serum creatinine (SCr) of 3.1 mg/dL?"
10.21019/qna-901511,"Calculate the appropriate dose of rituximab (in mg) for Jose, who is 74” and weighs 220 lb undergoing treatment for non-Hodgkin’s lymphoma. The recommended dose of rituximab is 375 mg/m2/dose. (Hint: Use the Mosteller method)."
10.21019/qna-901513,"A 34-year-old cisgender man is to receive vancomycin 15 mg/kg I.V. every 8 hours. Vancomycin is dosed based on actual body weight, even in patients who are overweight. If vancomycin doses come in increments of 250 mg, what is a single dose for this man who is 6’5” and weighs 295 lb?"
10.21019/qna-901514,"The dose of Drug X for a patient named JC who weighs 132 lb is determined to be in direct proportion to the patient’s weight. If the daily dose of Drug X for another patient weighing 70 kg is calculated to be 1,000 mg, what should be the dose in grams for JC for 1 week of treatment?"
10.21019/qna-901515,"One box of herbal product contains 50 individual packs of this product. Each pack contains 25 g of powdered leaves, and 5 mg of the active constituents is present in each gram of this powdered product. Calculate the total amount of active ingredient present in one box."
10.21019/qna-901516,"Which of the following is the correct way to indicate that a patient is to receive 40 mg of simvastatin per day, avoiding error-prone abbreviations, symbols, and dose designations?"
10.21019/qna-901517,Which of the following is a required component of an outpatient prescription label?
10.21019/qna-901518,The following directions are written on a prescription:
10.21019/qna-901519,Which among the following is the correct way to write “apply ointment twice a day as needed for itching” using appropriate abbreviations?
10.21019/qna-901520,"To prevent error-prone dosing designations, which of the following given expression is the appropriate way to indicate “one thousand” units?"
10.21019/qna-901521,"Larry Berkowitz, a physician’s assistant, writes a prescription for a controlled drug substance. The DEA number on the prescription is MB5128931. Is this DEA number correct?"
10.21019/qna-901522,How close the experimental value is in relation to the true/actual value is called
10.21019/qna-901523,Define the capacity of a scale.
10.21019/qna-901524,Precision of experimental results can be measured by standard deviation
10.21019/qna-901525,Calculate the minimum amount that can be weighed on a balance that has a sensitivity requirement (SR) of 5 mg with 98% accuracy.
10.21019/qna-901526,"If 100 mL of water is added to 15 mL of an aqueous drug solution, what will be the volume of this new solution that will contain 10 mL of the drug solution?"
10.21019/qna-901527,"Children’s cough syrup contains 100 mg of ibuprofen per teaspoonful. If the patient consumes 5 mL of the medication two times daily, how many grams of medication will be consumed by the patient in 2 days?"
10.21019/qna-901528,An antacid suspension contains 1 grain of the active ingredient in each fluid ounce of the preparation. How many milliliters contain 200 mg of the active ingredient?
10.21019/qna-901529,Calculate the minimum amount that can be weighed on a prescription balance with a 10 mg sensitivity requirement with a ±5% error limit allowed.
10.21019/qna-901530,Mix 50% and 10% solutions in a __________ ratio to prepare a 30% solution?
10.21019/qna-901531,_________ mg of diphenhydramine hydrochloride is required to prepare 300 mL of a 60 mg% solution.
10.21019/qna-901532,1.3 g of glucose are contained in 50 mL of ____% w/w glucose solution having a specific gravity of 1.040?
10.21019/qna-901533,Calculate the percentage (% w/w) of efavirenz in the following preparation to be reconstituted into water to make a suspension.
10.21019/qna-901534,Calculate the volume of stock solution of flurbiprofen sodium 1:100 w/v that will be required to compound the following prescription?
10.21019/qna-901535,Calculate the quantity of hydrocarbon base required to be mixed with 250 g of 5% and 750 g of 15% sulfur ointments to prepare a sulfur ointment with 10% strength.
10.21019/qna-901536,"A pharmacist decides to compound 10% benzocaine ointment. The ratio in which 1%, 5% and 15%, ointment should be mixed to prepare 10% hydrocortisone ointment is"
10.21019/qna-901537,"If equal portions of 1% and 5% hydrocortisone ointment are mixed uniformly, calculate the final percentage strength of the hydrocortisone ointment prepared."
10.21019/qna-901538,"A 63-year-old cisgender man weighing 180 pounds and 160 centimeters tall is to receive a loading dose of aminophylline at 5.6 mg/kg ideal body weight. Calculate the volume of aminophylline injection, USP 250 mg (25 mg/mL) required to dispense the loading dose for this patient."
10.21019/qna-901539,"Today UM weighs 112 lb, but 2 years ago he weighed 85 kg. What percentage of his body weight has UM lost or gained?"
10.21019/qna-901540,Which of the following are considered micronutrients? a. Amino acids b. Trace minerals c. Electrolytes d. Dextrose e. Fats f. Vitamins
10.21019/qna-901541,"Calculate the caloric needs, using the Harris Benedict equation, for an 18-year-old male with mild trauma. He is 5’9” tall and weighs 58.8 kilograms."
10.21019/qna-901542,Calculate the disintegration constant of a radioactive element 64Cu (half-life = 12.8 hours).
10.21019/qna-901543,"Jaclyn, a 33-year-old female who is 5’2” and weighs 137 pounds, has been admitted to the intensive care unit in severe stress after suffering burns to >50% of her body in a house fire. Jaclyn needs ~2,775 calories per day. Calculate the CALORIES that should come from carbohydrates if the hospital pharmacy has following solutions to compound total parenteral nutrition (TPN). 10% amino acid solution 500 mL of 20% fat emulsion 50% dextrose solution"
10.21019/qna-901544,"Jaclyn, a 33-year-old female who is 5’2” and weighs 137 pounds, has been admitted to the intensive care unit in severe stress after suffering burns to >50% of her body in a house fire. Jaclyn needs ~2,775 calories per day. Calculate the amount of protein in grams that will be needed for compound the total parenteral nutrition (TPN) for Jaclyn. 10% amino acid solution 500 mL of 20% fat emulsion 50% dextrose solution"
10.21019/qna-901545,"MVE, a 51-year-old cisgender man weighing 132 lb with liver disease, is being started on an octreotide drip for variceal bleeding. The drip is set at 50 μg/hr and contains 25 mg of octreotide in 100 mL of normal saline solution. Calculate the infusion rate in mL/hr."
10.21019/qna-901546,A pharmacist has 200 mL of 20% dextrose solution and 300 mL of 15% dextrose solution. Calculate the concentration of dextrose in the resulting solution if the pharmacist mixed one-half of each solution.
10.21019/qna-901547,How many milliliters of water must be added to 500 g of 34% w/w alcohol to make 17% w/w alcohol? (Assume no contraction of alcohol occurs.)
10.21019/qna-901548,A solution contains 0.20 mEq/mL of mono-potassium phosphate (KH2PO4; M.W = 136 g/mol). Calculate the osmolarity of this solution (mOsmol/L).
10.21019/qna-901549,"Determine if 10 mL 10% w/v solution of dextrose (E dextrose = 0.16) solution in water is isotonic, hypertonic, or hypotonic."
10.21019/qna-901550,"A neonate weighing 3 lb 8 oz is receiving an infusion of D5W at a rate of 75 mL/kg/day. How much volume, in mLs, is the neonate receiving per day? (16 ounces = 1 pound)"
10.21019/qna-901551,"The label information for a 75 mL bottle of amoxicillin/clavulanate 125 mg/5 mL says to add 67 mL purified water to the bottle of powder to create 75 mL of amoxicillin/clavulanate suspension. The patient is instructed to take 112.5 mg twice a day for 7 days. If 80 mL of purified water was accidentally added to the amoxicillin/clavulanate bottle, what volume of the suspension (mL) would the patient need to take per single dose?"
10.21019/qna-901552,"Calculate the amount of boric acid in grams that is required to compound 30 mL of a 1% w/v pilocarpine hydrochloride ophthalmic solution isotonic. (EPilocarpine HCl = 0.24, EBoric acid = 0.52)"
10.21019/qna-901553,"Calculate the BMI for a patient who is 5’1” and weighs 56.3 kilograms. Determine if the patient is underweight, normal weight, overweight, or obese."
10.21019/qna-901554,Calculate the molar concentration of 2% calcium chloride solution (M.W CaCl2= 110.98 g/mol)
10.21019/qna-901555,"A 210 lb patient was hospitalized and was identified as a high bleeding risk patient with a partial thromboplastin time (PTT) value of 55. The patient should be administered with heparin according to the sample protocol given below. Sample heparin protocol* Heparin is available as a 30,000 USP units/30mL in a 30 mL multi-dose vial. For infusion heparin is available as 25,000 units of heparin in 500 mL dextrose 5% in water (D5W) bags. Based on the above protocol, calculate the rate of heparin infusion in drops/min if the I.V. set is adjusted to deliver 20 drops per milliliter for this patient."
10.21019/qna-901556,"There is an amoxicillin oral suspension 125 mg/5mL suspension. When reconstituted with water, each 5 mL (one teaspoon) will contain amoxicillin trihydrate equivalent to 125 mg of amoxicillin. Sig: 1 tsp PO q 12 hr x 10 days Calculate the volume of this amoxicillin oral suspension that will be consumed by the patient by the end of 10 days of dosing."
10.21019/qna-901557,You must reconstitute 1 g of dry powder of an antibiotic for use. The label states “add 9.3 mL of diluent to make the final solution with 100 mg/mL strength.” Calculate the powder volume of this antibiotic drug occupied in the vial.
10.21019/qna-901558,There is a need to create ten 30-mg phenobarbital suppositories in cocoa butter. How many grams each of cocoa butter and drug X should be weighed? Density factor of Drug X in cocoa butter = 1.2l Weight of blank suppository with base only = 1 g
10.21019/qna-901559,"Calculate the calories present in 150 mL of a commercially available stock solution that contains electrolytes, amino acids, and glycerin (3% w/v)."
10.21019/qna-901560,A female patient who is 6 ft 2 in tall and weighs 175 lbs is undergoing a chemotherapy cycle of paclitaxel and cetuximab. The patient is scheduled to receive the following initial regimen for her neck cancer: paclitaxel 80 mg/m2 per day I.V. on Day 1 (total dose per cycle = 80 mg/m2) and cetuximab 400 mg/m2 per day I.V. on Day 1 (total dose per cycle = 400 mg/m2) Calculate the daily chemotherapy doses for this patient.
10.21019/qna-901561,A 26-year-old patient presents with fatigue and shortness of breath. The patient reports transitioning to a vegetarian diet a few years ago. Mean corpuscular volume (MCV) is 62 fL. What type of anemia does the MCV suggest?
10.21019/qna-901562,A 55-year-old patient with a history of chronic alcohol abuse presents with weakness and pallor. Lab results show a hemoglobin level of 11 g/dL and an MCV of 112 fL. What is the most likely cause of his anemia? (Select ALL that apply.)
10.21019/qna-901563,A patient with chronic kidney disease weighs 80 kg and requires erythropoietin therapy. The recommended starting dose of erythropoietin alfa is 100 units/kg three times per week. Calculate the total weekly dose for this patient in units. (Answer must be numeric; round the final answer to the nearest WHOLE number.)
10.21019/qna-901564,A patient weighs 165 lbs and requires erythropoietin therapy. The recommended starting dose of erythropoietin alfa is 100 units/kg three times per week. Calculate the total weekly dose in units for this patient. (Answer must be numeric; round the final answer to the nearest WHOLE number.)
10.21019/qna-901565,A patient with chronic kidney disease-associated anemia weighs 75 kg and requires darbepoetin alfa therapy. The recommended starting dose of darbepoetin alfa is 0.45 mcg/kg administered once every two weeks. Calculate the total dose of darbepoetin alfa per administration in mcg for this patient.
10.21019/qna-901566,A patient with iron deficiency anemia is scheduled to receive iron dextran intravenously. What is the recommended infusion time for low molecular weight iron dextran to minimize the risk of adverse reactions?
10.21019/qna-901567,"A prescription for iron supplementation reads: ""Ferrous sulfate 325 mg tablets, take one tablet by mouth daily."" The patient has a history of gastritis. What counseling point is correct to provide when dispensing this medication?"
10.21019/qna-901568,"As a pharmacist managing medication-use systems to ensure safety in the treatment of anemia, which of the following strategies is most appropriate?"
10.21019/qna-901569,The montelukast 2020 boxed warning refers to which type of serious side effect?
10.21019/qna-901570,Prolonged use of which of the following medications in the treatment of acute exacerbation of COPD could result in deleterious side effects?
10.21019/qna-901571,Which positive lab value best supports the addition of an inhaled corticosteroid for a patient with COPD?
10.21019/qna-901572,"When using the Spiriva respimat device, patients should be instructed to first do which of the following?"
10.21019/qna-901573,Which of the following medications can be used as both a COPD and asthma maintenance medication in select patients?
10.21019/qna-901574,Monthly refill requests of albuterol HFA for asthma can suggest poor adherence to which of the following medications?
10.21019/qna-901575,Which of the following combination inhaled medication is an effective first line option for treatment of acute exacerbation of COPD?
10.21019/qna-901576,Which of the following symptoms could suggest uncontrolled asthma?
10.21019/qna-901577,"The ROCKET AF trial was a prospective, randomized, non-inferiority trial where patients (n=14,264) with nonvalvular atrial fibrillation who were at increased risk for stroke received either rivaroxaban or dose-adjusted warfarin. The primary endpoint was incidence of stroke or systemic embolism, and a secondary endpoint was fatal bleeding. In the primary analysis, the primary end point occurred at a rate of 1.7% per year in the rivaroxaban group and a rate of 2.2% per year in the warfarin group (hazard ratio in the rivaroxaban group, 0.79; 95% confidence interval [CI], 0.66 to 0.96; P<0.001 for noninferiority). The frequency of fatal bleeding was 0.2% and 0.5% (P=0.003) in the rivaroxaban and warfarin groups, respectively. Which of the following conclusions provides the best interpretation of this result for the primary end point? (Select ALL that apply.)"
10.21019/qna-901578,"The ROCKET AF trial was a prospective, randomized, non-inferiority trial where patients (n=14,264) with nonvalvular atrial fibrillation who were at increased risk for stroke received either rivaroxaban or dose-adjusted warfarin. The primary endpoint was incidence of stroke or systemic embolism, and a secondary endpoint was fatal bleeding. In the primary analysis, the primary end point occurred at a rate of 1.7% per year in the rivaroxaban group and a rate of 2.2% per year in the warfarin group (hazard ratio in the rivaroxaban group, 0.79; 95% confidence interval [CI], 0.66 to 0.96; P<0.001 for noninferiority). The frequency of fatal bleeding was 0.2% and 0.5% (P=0.003) in the rivaroxaban and warfarin groups, respectively. Which of the following conclusions provides the best interpretation of this result for the secondary endpoint of fatal bleeding? (Select ALL that apply.)"
10.21019/qna-901579,A study aimed to determine whether therapy with piperacillin-tazobactam is noninferior to meropenem in patients with bloodstream infection caused by ceftriaxone-nonsusceptible E coli or K pneumoniae. The primary outcome was all-cause mortality at 30 days after randomization. What type of variable is the dependent variable in this study?
10.21019/qna-901580,What is the most appropriate measure of central tendency for the age of a population included in a study if the data are normally distributed?
10.21019/qna-901581,Which of the following definitions best describes a relative risk ratio?
10.21019/qna-901582,Which of the following definitions best describes a null hypothesis?
10.21019/qna-901583,Which of the following statements best describes intention-to-treat (ITT) analysis?
10.21019/qna-901584,A physician receives a pharmacogenomics report for one of their patients and results indicate the patient is a CYP2D6 poor metabolizer phenotype. The therapeutic consideration states to avoid tramadol due to lack of therapeutic response. The physician asks you why the patient may not have a therapeutic response to tramadol with this phenotype. Which of the following is the best explanation?
10.21019/qna-901585,Which of the following genes included in a pharmacogenomics test are associated with pharmacodynamic responses to drugs? (Select ALL that apply)
10.21019/qna-901586,You receive an order for a loading dose of trastuzumab 4 mg/kg IV over 90 minutes. Which of the following is an appropriate indication for this order?
10.21019/qna-901587,Which of the following are components of real-time continuous glucose monitoring (CGM) equipment? (Select ALL that apply)
10.21019/qna-901588,"You are a pharmacist for nationwide healthcare system, and they are interested in launching a pilot program to test the clinical feasibility of using pharmacogenomics testing for HLA-B*15:02 to guide therapy for carbamazepine. The implementation team asks which clinical outcome will be most useful for monitoring safety during the pilot program. Which is the best outcome to suggest?"
10.21019/qna-901589,"You are a pharmacist for nationwide healthcare system, and they are interested in launching a pilot program to test the clinical feasibility of using pharmacogenomics testing for CYP2C19 to guide therapy for depression with citalopram. The implementation team asks which clinical outcome will be most useful for monitoring safety during the pilot program. Which is the best outcome to suggest?"
10.21019/qna-901590,"You are a pharmacist for nationwide healthcare system, and they are interested in launching a pilot program to test the clinical feasibility of using pharmacogenomics testing for CYP2C19 to guide antiplatelet therapy with clopidogrel for patients receiving a stent (PCI) after acute coronary syndrome. The implementation team asks which metabolizer phenotype should avoid therapy with clopidogrel and receive alternative antiplatelet therapy due to risk of decreased effectiveness. According to the Clinical Pharmacogenetics Implementation Consortium (CPIC) Guidelines, which CYP2C19 metabolizer phenotype is recommended to avoid clopidogrel if possible and use prasugrel or ticagrelor if no contraindication?"
10.21019/qna-901591,"A study aimed to determine whether therapy with piperacillin-tazobactam is noninferior to meropenem in patients with bloodstream infection caused by ceftriaxone-nonsusceptible E coli or K pneumoniae. The primary outcome was all-cause mortality at 30 days after randomization. Results reported a total of 12.3% and 3.7%randomized to piperacillin-tazobactam and meropenem, respectively, met the primary outcome of mortality at 30 days (P = .90 for noninferiority). Which of the following statements is an accurate interpretation of these data?"
10.21019/qna-901592,"Investigators recruit 30 healthy volunteers to determine if an investigational drug therapy is safe. The drug is administered in escalating oral doses of 10 mg daily, 20 mg daily, and 40 mg daily for 1 week each. Investigators then assess the data for safety and optimal dosage. What type of trial does this describe?"
10.21019/qna-901593,"In clinical trials, which study design characteristic would help minimize both reporting bias by patients or measurement from clinicians bias related to reporting of side effects?"
10.21019/qna-901594,"A 64-year-old person began experiencing osteonecrosis of the jaw (ONJ) 3 years after starting alendronate therapy for osteoporosis requiring treatment discontinuation. After exploring your electronic health records data set, you identified 9 additional patients who were diagnosed with ONJ after being prescribed alendronate over the past 7 years. What is the best method to publish these data in a peer-reviewed journal?"
10.21019/qna-901595,A study aimed to determine whether therapy with piperacillin-tazobactam is noninferior to meropenem in patients with bloodstream infection caused by ceftriaxone-nonsusceptible E coli or K pneumoniae. The primary outcome was all-cause mortality at 30 days after randomization. Which of the following variables would be considered a confounder in this study?
10.21019/qna-901596,"A study evaluated the mean IV dose of a loop diuretic needed to obtain a diuretic response of 1 liter of urine after administration. If you wanted to extrapolate these results to choose an oral equivelent dose of the drug, which pharmacokinetic parameter would be most useful?"
10.21019/qna-901597,"A Phase 1 study reported a novel drug with a high first-pass metabolism was safe when administered orally to healthy volunteers. Which patient population may have a higher peak concentration of the drug, compared to the concentration reported in this healthy population?"
10.21019/qna-901598,"What is the primary characteristic of eczema, also known as atopic dermatits?"
10.21019/qna-901599,Which of the following skin conditions is characterized by a chronic autoimmune response that leads to the rapid growth of skin cells resulting in thick white/silvery plaques?
10.21019/qna-901600,Which dermatologic condition is primarily caused by an overgrowth of yeast on the skin and presents as round or oval-shaped patches with flaking or scaling?
10.21019/qna-901601,Which physicochemical property of a topical corticosteroid formulation is crucial for ensuring effective absorption into the skin in the treatment of inflammatory skin conditions?
10.21019/qna-901602,"In managing a patient with acne, which technique or procedure is commonly used for the application of topical treatments to enhance penetration and efficacy?"
10.21019/qna-901603,"As part of an interdisciplinary approach to managing dermatologic disorders, which healthcare professional is most likely to collaborate with a pharmacist in providing comprehensive care to patients with psoriasis? (Select ALL that apply.)"
10.21019/qna-901604,How does the concept of continuity of care apply to the management of chronic dermatologic conditions such as eczema?
10.21019/qna-901605,A lubricant ophthalmic drop product contains 0.01% w/v of Benzalkonium Chloride. What is the role of Benzalkonium Chloride is this formulation?
10.21019/qna-901606,Suppositories prepared with Polyethylene Glycol (PEG) are highly hygroscopic in nature. Which of the following is a correct patient counselling guideline for use of this product?
10.21019/qna-901607,"What is the role of a glidant in powder, granules and tablet dosage forms?"
10.21019/qna-901608,"According to UPS Chapter 795, which of the following is maximum beyond-use date for aqueous topical pain relief gel?"
10.21019/qna-901609,Which of the following tablet compounding problem is defined as 'the uneven distribution of colored excipients/drugs in the tablet'?
10.21019/qna-901610,A pharmacist prepared an intravenous infusion with osmolarity of 675 mOsm/L. Which of the following is true regarding the tonicity of this formulation?
10.21019/qna-901611,"What is the maximum withdrawable volume, in milliliters, of a multidose parenteral vial?"
10.21019/qna-901612,"A patient experiences ventricular tachycardia and is started on amiodarone at 1mg/min for 6 hours, followed by 0.5 mg/min. The patient has been on amiodarone for a total of 20 hours. How much amiodarone, in mg, has the patient received at the end of 20 hours? (Answer must be numeric; round the answer to the nearest WHOLE number.)"
10.21019/qna-901613,"A 58-year-old patient (Ht 5'5"", Wt 75.2kg, BSA 1.86m2) presents to the hospital hypotensive with a BP 87/54mmHg. The following hemodynamic parameters are obtained: CO 4.2 L/min, PCWP 17 mmHg, SVR 1920 dynes/sec/cm-5. What is this patient's cardiac index?"
10.21019/qna-901614,"A 42-year-old patient (Ht 5'9"", Wt 60kg) has been on continuous infusions of norepinephrine 0.2 mcg/kg/min, fentanyl 50 mcg/hr, and propofol 25 mcg/kg/min for the last 24 hours. The following products are being used: norepinephrine 8mg/250mL, fentanyl 500mcg/50mL, propofol 1000mg/100mL. How much total volume, in mL, has this patient received through their continuous infusions in the last 24 hours? (Answer must be numeric; round the answer to the nearest WHOLE number.)"
10.21019/qna-901615,A meta-analysis of stuides evaluating a strategy of lower vs. higher resuscitation fluid volumes was conducted in patients with sepsis. The analysis showed that the relative risk (RR) of all-cause mortality with lower compared to higher volumes was 0.99 (95% CI: 0.89 - 1.10). Which of the following statements is accurate?
